{
  "schema_version": 1,
  "card_id": "AC-10",
  "kind": "service-fact",
  "lifecycle": "ga",
  "service": "bedrock-agentcore",
  "category": "core-services",
  "tags": [
    "agentcore",
    "observability",
    "otel",
    "tracing"
  ],
  "badge_variant": "core",
  "badge_text": "CORE SERVICE",
  "art": "observe",
  "title": "Observability",
  "hook": "OpenTelemetry-based tracing of every reasoning step, tool call, and token an agent spends.",
  "back": {
    "lead": "Observability gives step-by-step visibility into agent execution: reasoning traces, tool invocations, latency, errors, and token/cost metrics — end to end across all AgentCore services, surfaced through CloudWatch and OTEL-compatible backends.",
    "kv": [
      {
        "k": "Trajectories",
        "v": "Inspect full session trajectories with metadata tagging, custom scoring, and debug filters."
      },
      {
        "k": "Standards",
        "v": "Built on OpenTelemetry, so traces flow into your existing observability stack, not a walled garden."
      },
      {
        "k": "Why special",
        "v": "Traditional APM sees latency and errors; agent observability must also answer 'did it pick the right tool and why?'"
      }
    ],
    "hookline": "You can't govern or improve what you can't see — Observability is the raw data feed for Evaluations."
  },
  "slots": {},
  "facts_used": [],
  "sources": [],
  "verified_at": null,
  "confidence": "medium",
  "depends_on": [],
  "aka": [],
  "superseded_by": null,
  "supersedes": [],
  "needs_review": false,
  "review_reasons": [],
  "provenance": {
    "tier": "seed",
    "authored_by": "legacy-import",
    "history": [
      {
        "at": "2026-08-06T12:57:02.398Z",
        "tier": "seed",
        "action": "import",
        "generator": "tools/extract-legacy.ts",
        "reason": "Mechanical migration from agentcore-flashcards.html; card text lifted verbatim from the legacy DECK literal."
      }
    ]
  },
  "created_at": "2026-08-06T12:57:02.398Z",
  "updated_at": "2026-08-06T12:57:02.398Z"
}
