{
  "schema_version": 1,
  "card_id": "BR-03",
  "kind": "service-fact",
  "lifecycle": "retired",
  "service": "bedrock",
  "category": "bedrock",
  "tags": [
    "grok",
    "spacexai",
    "context-window",
    "reasoning",
    "agents"
  ],
  "badge_variant": "ga",
  "badge_text": "GA",
  "art": "platform",
  "title": "Amazon Bedrock supports SpaceXAI Grok 4.6",
  "hook": "What capabilities does SpaceXAI Grok 4.6 bring to Amazon Bedrock?",
  "back": {
    "lead": "SpaceXAI Grok 4.6 is now available on Amazon Bedrock, offering a 500K context window and configurable reasoning efforts (low, medium, high, xhigh). The model is built for long-running agents and ambitious interactive and visual work.",
    "hookline": "SpaceXAI's flagship model with a focus on staying with complex tasks across many steps.",
    "kv": [
      {
        "k": "Context window",
        "v": "500K"
      },
      {
        "k": "Reasoning levels",
        "v": "low, medium, high, xhigh"
      },
      {
        "k": "Built for",
        "v": "long-running agents, interactive & visual work"
      }
    ]
  },
  "slots": {},
  "facts_used": [],
  "sources": [
    {
      "url": "https://aws.amazon.com/about-aws/whats-new/recent/feed/",
      "kind": "aws-whats-new",
      "fetched_at": "2026-08-19T19:22:57.428Z",
      "content_hash": "sha256:5e7274b345aeac906e2964fa7338600722722073525410bb24bf04991f32c737"
    }
  ],
  "verified_at": null,
  "confidence": "medium",
  "depends_on": [],
  "aka": [],
  "superseded_by": null,
  "supersedes": [],
  "needs_review": false,
  "review_reasons": [],
  "provenance": {
    "tier": "C",
    "authored_by": "model",
    "history": [
      {
        "at": "2026-08-19T23:54:59.456Z",
        "tier": "C",
        "action": "import",
        "generator": "tools/apply-new-card.ts",
        "reason": "Drafted from coverage gap \"Amazon Bedrock now supports SpaceXAI Grok 4.6\" (August 2026). no checkable (numeric/date/region) claim in the draft — needs a human read regardless"
      },
      {
        "at": "2026-08-19T23:54:59.456Z",
        "tier": "C",
        "action": "flag-review",
        "generator": "tools/apply-new-card.ts",
        "reason": "New card drafted from coverage gap \"Amazon Bedrock now supports SpaceXAI Grok 4.6\". Every checkable claim verified against the source entry, but a new card's category, kind, lifecycle and framing are judgement calls no source can settle. Model au.anthropic.claude-sonnet-4-5-20250929-v1:0."
      },
      {
        "at": "2026-08-20T00:50:00.000Z",
        "tier": "C",
        "action": "retire",
        "generator": "human",
        "reason": "This card is exactly the anti-pattern content/coverage-ignore.json already names twice (Claude Opus 5, GPT-5.6 Sol/Terra/Luna): a Bedrock model-roster addition, not a durable service capability. BR-01 carries the model catalogue as a fact-governed slot ('over N foundation models... among others') and the teachable idea is that the roster grows continuously, not any one model's arrival. Retiring rather than deleting per FR-9/FR-10 — the id BR-03 is never reused. See docs/decisions/2026-08-20-scope-widened-to-aws-ai-broadly.md and content/coverage-ignore.json's new entry for the same heading."
      }
    ]
  },
  "created_at": "2026-08-19T23:54:59.456Z",
  "updated_at": "2026-08-20T00:50:00.000Z"
}
