{
  "schema_version": 1,
  "card_id": "CA-01",
  "kind": "service-fact",
  "lifecycle": "ga",
  "service": "q-developer",
  "category": "coding-agents",
  "tags": [
    "aws",
    "coding-agents",
    "ide",
    "q-developer"
  ],
  "badge_variant": "core",
  "badge_text": "CODING AGENT",
  "art": "cli",
  "title": "Amazon Q Developer",
  "hook": "A conversational assistant for understanding, building, extending and operating AWS applications.",
  "back": {
    "lead": "Amazon Q Developer is a generative-AI conversational assistant that helps you understand, build, extend and operate AWS applications. You can ask about AWS architecture, your own AWS resources, best practices, documentation and support. It is built on Amazon Bedrock and inherits the abuse detection Bedrock implements.",
    "kv": [
      {
        "k": "In the IDE",
        "v": "Chats about code, provides inline completions, generates new code, scans for security vulnerabilities, and makes upgrades such as language version moves, debugging and optimisation."
      },
      {
        "k": "Substrate",
        "v": "Built on Amazon Bedrock, so the safety and responsible-use controls come from the same place as the rest of your Bedrock workloads."
      },
      {
        "k": "Where it fits",
        "v": "The AWS-aware assistant: strongest when the question is about your account, your resources, or AWS itself rather than about a codebase in the abstract."
      }
    ],
    "hookline": "Ask it about AWS and your own resources — that account awareness is what it has and a general coding agent does not."
  },
  "slots": {},
  "facts_used": [],
  "sources": [
    {
      "url": "https://docs.aws.amazon.com/amazonq/latest/qdeveloper-ug/what-is.html",
      "title": "What is Amazon Q Developer?",
      "kind": "aws-docs",
      "fetched_at": "2026-08-08T13:24:03.069Z",
      "content_hash": "sha256:280c9c68b96a8b25e81e3d314c5c03237b7629cd0fbd095a6dfad75b581a1045"
    }
  ],
  "verified_at": "2026-08-08T13:24:03.069Z",
  "confidence": "medium",
  "depends_on": [],
  "aka": [],
  "superseded_by": null,
  "supersedes": [],
  "needs_review": false,
  "review_reasons": [],
  "provenance": {
    "tier": "C",
    "authored_by": "model",
    "history": [
      {
        "at": "2026-08-08T13:26:31.267Z",
        "tier": "C",
        "action": "import",
        "generator": "tools/add-cards-p6-batch1.ts",
        "reason": "New card authored from https://docs.aws.amazon.com/amazonq/latest/qdeveloper-ug/what-is.html. Every new card enters through Tier C."
      }
    ]
  },
  "created_at": "2026-08-08T13:26:31.267Z",
  "updated_at": "2026-08-08T13:26:31.267Z"
}
