{
  "schema_version": 1,
  "card_id": "AC-01",
  "kind": "service-fact",
  "lifecycle": "ga",
  "service": "bedrock-agentcore",
  "category": "foundations",
  "tags": [
    "agentcore",
    "overview",
    "platform"
  ],
  "badge_variant": "ga",
  "badge_text": "GA OCT 2025",
  "art": "platform",
  "title": "What is AgentCore?",
  "hook": "AWS's agentic platform: build, deploy, and operate agents at scale — any framework, any model.",
  "back": {
    "lead": "Amazon Bedrock AgentCore is a fully managed platform for running AI agents in production. You bring the agent code; AgentCore supplies infrastructure, session isolation, memory, tool connectivity, identity, governance, and monitoring — with no servers to manage.",
    "kv": [
      {
        "k": "Agnostic",
        "v": "Works with any framework (Strands, LangGraph, CrewAI, LlamaIndex) and any model — Bedrock-hosted or not (incl. Anthropic API)."
      },
      {
        "k": "GA",
        "v": "Preview Jul 16 2025 → generally available Oct 13 2025, with VPC, PrivateLink, CloudFormation, and tagging support."
      },
      {
        "k": "Positioning",
        "v": "Sits in AWS's agent infrastructure layer alongside Bedrock (models), Nova, and Strands Agents (framework)."
      }
    ],
    "hookline": "It is not a framework and not a model — it's the production substrate underneath whichever framework and model you choose."
  },
  "slots": {},
  "facts_used": [],
  "sources": [],
  "verified_at": null,
  "confidence": "medium",
  "depends_on": [],
  "aka": [],
  "superseded_by": null,
  "supersedes": [],
  "needs_review": false,
  "review_reasons": [],
  "provenance": {
    "tier": "seed",
    "authored_by": "legacy-import",
    "history": [
      {
        "at": "2026-08-06T12:57:02.398Z",
        "tier": "seed",
        "action": "import",
        "generator": "tools/extract-legacy.ts",
        "reason": "Mechanical migration from agentcore-flashcards.html; card text lifted verbatim from the legacy DECK literal."
      }
    ]
  },
  "created_at": "2026-08-06T12:57:02.398Z",
  "updated_at": "2026-08-06T12:57:02.398Z"
}
