{
  "schema_version": 1,
  "card_id": "AC-12",
  "kind": "service-fact",
  "lifecycle": "ga",
  "service": "bedrock-agentcore",
  "category": "governance-quality",
  "tags": [
    "agentcore",
    "evaluations",
    "quality"
  ],
  "badge_variant": "ga",
  "badge_text": "GA MAR 2026",
  "art": "evals",
  "title": "Evaluations",
  "hook": "Continuous, managed quality scoring of real agent behavior — sessions, responses, and tool calls.",
  "back": {
    "lead": "Evaluations continuously monitors agent quality against real-world behavior. Built-in evaluators (13 at launch) score dimensions like correctness, helpfulness, and safety; custom evaluators cover business-specific criteria. It runs against sampled production traffic or on demand.",
    "kv": [
      {
        "k": "One bar",
        "v": "The same evaluators run in dev, in CI/CD gates, and in production monitoring — one quality standard across the lifecycle."
      },
      {
        "k": "GA adds",
        "v": "Ground-truth support (reference answers, behavioral assertions, expected tool trajectories) and custom code evaluators hosted in Lambda."
      },
      {
        "k": "Regions",
        "v": "{{slot:evaluations_regions}}"
      }
    ],
    "hookline": "External verifiers scoring agent output — the managed version of 'never trust the agent's self-report'."
  },
  "slots": {
    "evaluations_regions": {
      "tier": "A",
      "template": "GA in {{fact:agentcore.feature-regions.evaluations.count}} regions incl. Sydney, Tokyo, Singapore, Frankfurt, Ireland, and US East/West.",
      "facts": [
        "agentcore.feature-regions.evaluations.count",
        "agentcore.feature-regions.evaluations.regions"
      ],
      "rendered": "GA in 16 regions incl. Sydney, Tokyo, Singapore, Frankfurt, Ireland, and US East/West.",
      "rendered_from": "tier-a",
      "seed_text": "GA in 9 regions incl. Sydney, Tokyo, Singapore, Frankfurt, Ireland, and US East/West."
    }
  },
  "facts_used": [
    "agentcore.feature-regions.evaluations.count",
    "agentcore.feature-regions.evaluations.regions"
  ],
  "sources": [
    {
      "url": "https://docs.aws.amazon.com/bedrock-agentcore/latest/devguide/agentcore-regions.html",
      "title": "agentcore.feature-regions (aws-docs)",
      "kind": "aws-docs",
      "fetched_at": "2026-08-24T19:27:20.017Z",
      "content_hash": "sha256:f3b89f7889ee5168aa29611a47da55a2247e22e3da25ab66f60e7f8f9e852cfa"
    }
  ],
  "verified_at": "2026-08-24T19:27:20.017Z",
  "confidence": "high",
  "depends_on": [],
  "aka": [],
  "superseded_by": null,
  "supersedes": [],
  "needs_review": false,
  "review_reasons": [],
  "provenance": {
    "tier": "A",
    "authored_by": "legacy-import",
    "history": [
      {
        "at": "2026-08-06T12:57:02.398Z",
        "tier": "seed",
        "action": "import",
        "generator": "tools/extract-legacy.ts",
        "reason": "Mechanical migration from agentcore-flashcards.html; card text lifted verbatim from the legacy DECK literal."
      },
      {
        "at": "2026-08-06T12:57:02.398Z",
        "tier": "seed",
        "action": "flag-review",
        "generator": "tools/extract-legacy.ts",
        "reason": "Slot \"evaluations_regions\" has no deterministic source: Feature-level region availability. SSM /aws/service/global-infrastructure exposes service-level regions for bedrock-agentcore only; it cannot substantiate the region list for the Evaluations feature specifically. Needs a Tier C source (What’s New post or docs page) before this claim can be verified."
      },
      {
        "at": "2026-08-08T14:02:23.374Z",
        "tier": "A",
        "action": "clear-review",
        "generator": "tools/close-claim-gaps.ts",
        "slot": "evaluations_regions",
        "reason": "The slot recorded that service-level SSM data could not substantiate a feature-level region claim, pending a docs source. That source now exists: agentcore-regions.html is a feature × region matrix. Slot promoted from unresolvable seed to Tier A; src/ingest/apply.ts records the value change itself, with the facts that produced it."
      },
      {
        "at": "2026-08-08T14:02:23.508Z",
        "tier": "A",
        "action": "correct",
        "generator": "src/ingest/apply.ts",
        "slot": "evaluations_regions",
        "before": "GA in 9 regions incl. Sydney, Tokyo, Singapore, Frankfurt, Ireland, and US East/West.",
        "after": "GA in 16 regions incl. Sydney, Tokyo, Singapore, Frankfurt, Ireland, and US East/West.",
        "facts": [
          "agentcore.feature-regions.evaluations.count",
          "agentcore.feature-regions.evaluations.regions"
        ],
        "reason": "Deterministic source disagreed with the rendered claim. Corrected with zero model involvement."
      }
    ]
  },
  "created_at": "2026-08-06T12:57:02.398Z",
  "updated_at": "2026-08-08T14:02:23.508Z"
}
