{
  "schema_version": 1,
  "card_id": "BR-01",
  "kind": "service-fact",
  "lifecycle": "ga",
  "service": "bedrock",
  "category": "bedrock",
  "tags": [
    "bedrock",
    "foundation-models",
    "model-layer"
  ],
  "badge_variant": "core",
  "badge_text": "MODEL LAYER",
  "art": "platform",
  "title": "Amazon Bedrock",
  "hook": "Managed, enterprise-grade access to foundation models from many providers behind one set of APIs.",
  "back": {
    "lead": "Amazon Bedrock is a fully managed service that provides secure, enterprise-grade access to high-performing foundation models from leading AI companies, so you can build and scale generative-AI applications without operating inference infrastructure. {{slot:model_catalogue}}",
    "kv": [
      {
        "k": "Customisation",
        "v": "A model can be adapted rather than merely prompted: fine-tuning, continued pre-training and distillation are all first-class."
      },
      {
        "k": "Relationship to AgentCore",
        "v": "Bedrock supplies the model; AgentCore runs the agent. Most \"which should I use\" questions are really about which of those two layers the problem sits in."
      }
    ],
    "hookline": "Bedrock is the model layer. \"Which model\" is a Bedrock question; \"how do I run the agent\" is an AgentCore one."
  },
  "slots": {
    "model_catalogue": {
      "tier": "A",
      "template": "The catalogue runs to over {{fact:bedrock.what-is.model-count-floor}} foundation models, from Amazon, Anthropic, DeepSeek, Moonshot AI, MiniMax and OpenAI among others.",
      "facts": [
        "bedrock.what-is.model-count-floor"
      ],
      "rendered": "The catalogue runs to over 100 foundation models, from Amazon, Anthropic, DeepSeek, Moonshot AI, MiniMax and OpenAI among others.",
      "rendered_from": "tier-a",
      "seed_text": "The catalogue spans many providers."
    }
  },
  "facts_used": [
    "bedrock.what-is.model-count-floor"
  ],
  "sources": [
    {
      "url": "https://docs.aws.amazon.com/bedrock/latest/userguide/what-is-bedrock.html",
      "title": "bedrock.what-is (aws-docs)",
      "kind": "aws-docs",
      "fetched_at": "2026-08-24T19:27:21.433Z",
      "content_hash": "sha256:328a8d24c1b9cf5e81fbdd27e0bafa61a89b1cb98dd2ae306d3bcaabfbb64ae9"
    }
  ],
  "verified_at": "2026-08-24T19:27:21.433Z",
  "confidence": "high",
  "depends_on": [],
  "aka": [],
  "superseded_by": null,
  "supersedes": [],
  "needs_review": false,
  "review_reasons": [],
  "provenance": {
    "tier": "A",
    "authored_by": "model",
    "history": [
      {
        "at": "2026-08-09T06:05:00.864Z",
        "tier": "C",
        "action": "import",
        "generator": "tools/add-cards-p6-batch2.ts",
        "reason": "New card authored from https://docs.aws.amazon.com/bedrock/latest/userguide/what-is-bedrock.html. Every new card enters through Tier C."
      },
      {
        "at": "2026-08-09T06:05:02.253Z",
        "tier": "A",
        "action": "correct",
        "generator": "src/ingest/apply.ts",
        "slot": "model_catalogue",
        "before": "The catalogue spans many providers.",
        "after": "The catalogue runs to over 100 foundation models, from Amazon, Anthropic, DeepSeek, Moonshot AI, MiniMax and OpenAI among others.",
        "facts": [
          "bedrock.what-is.model-count-floor"
        ],
        "reason": "Deterministic source disagreed with the rendered claim. Corrected with zero model involvement."
      }
    ]
  },
  "created_at": "2026-08-09T06:05:00.864Z",
  "updated_at": "2026-08-09T06:05:02.253Z"
}
