{
  "schema_version": 1,
  "card_id": "AC-08",
  "kind": "service-fact",
  "lifecycle": "ga",
  "service": "bedrock-agentcore",
  "category": "built-in-tools",
  "tags": [
    "agentcore",
    "code-interpreter",
    "sandbox",
    "tools"
  ],
  "badge_variant": "core",
  "badge_text": "BUILT-IN TOOL",
  "art": "code",
  "title": "Code Interpreter",
  "hook": "A sandboxed environment where agents write and execute code — Python, JavaScript, TypeScript.",
  "back": {
    "lead": "Code Interpreter gives agents an isolated sandbox to write, run, and debug code. This dramatically improves accuracy on math, data analysis, and file transformation tasks, because the agent computes answers instead of guessing them.",
    "kv": [
      {
        "k": "Isolation",
        "v": "VM-level sandboxing keeps generated code away from your systems."
      },
      {
        "k": "Languages",
        "v": "Python, JavaScript, and TypeScript at launch."
      },
      {
        "k": "Billing",
        "v": "Per-second, based on active CPU/memory — you don't pay while the sandbox idles waiting on the model."
      },
      {
        "k": "Use cases",
        "v": "Data analysis, chart generation, file conversion, validation logic, agent 'self-checks'."
      }
    ],
    "hookline": "LLMs approximate; code computes. Give the agent an interpreter and its numeric answers become verifiable."
  },
  "slots": {},
  "facts_used": [],
  "sources": [],
  "verified_at": null,
  "confidence": "medium",
  "depends_on": [],
  "aka": [],
  "superseded_by": null,
  "supersedes": [],
  "needs_review": false,
  "review_reasons": [],
  "provenance": {
    "tier": "seed",
    "authored_by": "legacy-import",
    "history": [
      {
        "at": "2026-08-06T12:57:02.398Z",
        "tier": "seed",
        "action": "import",
        "generator": "tools/extract-legacy.ts",
        "reason": "Mechanical migration from agentcore-flashcards.html; card text lifted verbatim from the legacy DECK literal."
      }
    ]
  },
  "created_at": "2026-08-06T12:57:02.398Z",
  "updated_at": "2026-08-06T12:57:02.398Z"
}
