{
  "schema_version": 1,
  "card_id": "BR-05",
  "kind": "service-fact",
  "lifecycle": "ga",
  "service": "bedrock",
  "category": "bedrock",
  "tags": [
    "agentcore",
    "payments",
    "ai-agents",
    "bedrock",
    "apis"
  ],
  "badge_variant": "ga",
  "badge_text": "GA",
  "art": "platform",
  "title": "AgentCore payments (GA)",
  "hook": "What does AgentCore payments enable AI agents to do autonomously?",
  "back": {
    "lead": "AgentCore payments enables AI agents to autonomously discover, access, and pay for paid APIs, MCPs, and content with just a few lines of code.",
    "hookline": "Transacting agents with built-in security and guardrails.",
    "kv": [
      {
        "k": "Capability",
        "v": "Autonomous discovery, access, and payment for paid APIs, MCPs, and content"
      },
      {
        "k": "Enterprise features",
        "v": "Security, guardrails, and observability for production deployment at scale"
      },
      {
        "k": "Status",
        "v": "Generally available in Amazon Bedrock AgentCore"
      }
    ]
  },
  "slots": {},
  "facts_used": [],
  "sources": [
    {
      "url": "https://aws.amazon.com/about-aws/whats-new/recent/feed/",
      "kind": "aws-whats-new",
      "fetched_at": "2026-08-20T03:25:08.379Z",
      "content_hash": "sha256:6cc30b715d66db7aacbcf6df78c8dce44505dbb4345a66738a2381e9893f345e"
    }
  ],
  "verified_at": null,
  "confidence": "medium",
  "depends_on": [],
  "aka": [],
  "superseded_by": null,
  "supersedes": [],
  "needs_review": true,
  "review_reasons": [
    {
      "reason": "New card drafted from coverage gap \"AgentCore payments is now generally available in Amazon Bedrock AgentCore\". Every checkable claim verified against the source entry, but a new card's category, kind, lifecycle and framing are judgement calls no source can settle. Model au.anthropic.claude-sonnet-4-5-20250929-v1:0.",
      "raised_at": "2026-08-20T03:51:34.364Z",
      "raised_by": "tools/apply-new-card.ts"
    }
  ],
  "provenance": {
    "tier": "C",
    "authored_by": "model",
    "history": [
      {
        "at": "2026-08-20T03:51:34.364Z",
        "tier": "C",
        "action": "import",
        "generator": "tools/apply-new-card.ts",
        "reason": "Drafted from coverage gap \"AgentCore payments is now generally available in Amazon Bedrock AgentCore\" (August 2026). no checkable (numeric/date/region) claim in the draft — needs a human read regardless"
      },
      {
        "at": "2026-08-20T03:51:34.364Z",
        "tier": "C",
        "action": "flag-review",
        "generator": "tools/apply-new-card.ts",
        "reason": "New card drafted from coverage gap \"AgentCore payments is now generally available in Amazon Bedrock AgentCore\". Every checkable claim verified against the source entry, but a new card's category, kind, lifecycle and framing are judgement calls no source can settle. Model au.anthropic.claude-sonnet-4-5-20250929-v1:0."
      }
    ]
  },
  "created_at": "2026-08-20T03:51:34.364Z",
  "updated_at": "2026-08-20T03:51:34.364Z"
}
