{
  "schema_version": 1,
  "card_id": "AC-14",
  "kind": "service-fact",
  "lifecycle": "preview",
  "service": "bedrock-agentcore",
  "category": "new-in-2026",
  "tags": [
    "agentcore",
    "catalog",
    "governance",
    "registry"
  ],
  "badge_variant": "pv",
  "badge_text": "PREVIEW",
  "art": "registry",
  "title": "Agent Registry",
  "hook": "A governed org-wide catalog of agents, tools, skills, and MCP servers — with owners on record.",
  "back": {
    "lead": "As deployments scale from a handful of agents to hundreds, nobody knows what exists, who owns it, or whether it was approved. Agent Registry (preview via AgentCore) is a governed catalogue for discovering, sharing, and reusing agents, tools, skills, and MCP servers across an organization.",
    "kv": [
      {
        "k": "Records",
        "v": "Ownership, supported protocols, capabilities, and invocation details for each entry."
      },
      {
        "k": "Why it matters",
        "v": "Shadow-agent sprawl is a governance risk more mundane than prompt injection — and arguably more dangerous."
      }
    ],
    "hookline": "The 'service catalog' moment for agents: if it's not in the registry, it doesn't officially exist."
  },
  "slots": {},
  "facts_used": [],
  "sources": [],
  "verified_at": null,
  "confidence": "medium",
  "depends_on": [],
  "aka": [],
  "superseded_by": null,
  "supersedes": [],
  "needs_review": false,
  "review_reasons": [],
  "provenance": {
    "tier": "seed",
    "authored_by": "legacy-import",
    "history": [
      {
        "at": "2026-08-06T12:57:02.398Z",
        "tier": "seed",
        "action": "import",
        "generator": "tools/extract-legacy.ts",
        "reason": "Mechanical migration from agentcore-flashcards.html; card text lifted verbatim from the legacy DECK literal."
      }
    ]
  },
  "created_at": "2026-08-06T12:57:02.398Z",
  "updated_at": "2026-08-06T12:57:02.398Z"
}
